title,url,date,text
ВСУ ударили по Херсонской области,https://lenta.ru/news/2025/04/13/vsu-udarili-po-hersonskoy-oblasti/,2025-04-13 22:22:00,"Губернатор Херсонской области Владимир Сальдо заявил, что Вооруженные силы Украины (ВСУ) ударили по региону, работает система противовоздушной обороны (ПВО). Об этом он сообщил в своем Telegram-канале.
«Зафиксированы сбития нескольких БПЛА над акваториями Черного и Азовского морей, а также в небе над Нижнесерогозским и Геническим муниципальными округами», — сообщил Сальдо.
По его словам, также зафиксированы прилеты по коммунальной инфраструктуре и дорожной технике. Информация о пострадавших уточняется.
Ранее Сальдо заявил, что Владимир Зеленский срывает все мирные инициативы президента США Дональда Трампа по Украине. Политик назвал Зеленского «марионеткой нижнего уровня», которая беспрекословно выполняет указания. Губернатор подчеркнул, что мирным инициативам Трампа противостоят представители финансово-олигархической элиты и их ставленники из руководства государств и ряда международных организаций."
В ЕС начали готовить предложения для отмены пошлин США,https://lenta.ru/news/2025/04/13/v-es-nachali-gotovit-predlozheniya-dlya-otmeny-poshlin-ssha/,2025-04-13 22:20:00,"Перед встречей премьер-министра Италии Джорджи Мелони с президентом США Дональдом Трампом для переговоров по поводу пошлин, запланированной на 17 апреля, Еврокомиссия обращалась к странам-членам ЕС с вопросом о готовности закупать больше американских газа и оружия. Об этом написала газета Corriere della Sera без указания источников.
Уточняется, что в европейских странах начали готовить предложения для отмены пошлин США. Журналисты утверждают, что Италия «дала зеленый свет» по обоим пунктам после оценок, которые сделало правительство вместе с нефтегазовой компанией Eni и предприятиями из оборонной промышленностью, среди которых Leonardo. Власти общались с производствами, способными сотрудничать с США, а также с теми, кто уже занимается этим.
2 апреля Трамп подписал указ о повышении импортных пошлин на продукцию из 185 стран. Базовая ставка составила 10 процентов, однако для ряда государств пошлины достигли 30-55 процентов.
Наиболее высокие тарифы оказались у Камбоджи (49 процентов), Вьетнама (46 процентов), Таиланда (36 процентов) и Китая (34 процента). Решение ужесточить торговлю Трамп объяснил усиливающимся торговым дисбалансом, угрожающим национальной безопасности США."
Новосибирский чиновник потратил взятку на покупку бронетехники для СВО,https://lenta.ru/news/2025/04/13/vzatka/,2025-04-13 22:12:00,"Глава АО «Корпорация развития Новосибирской области» Александр Зырянов потратил взятку на покупку бронированных автомобилей «Газель», которые затем были отправлены в зону проведения спецоперации (СВО). Об этом пишет «Коммерсант» («Ъ»).
По данным издания, на покупку пяти бронированных «Газелей» потратили около трех миллионов рублей. Это в том числе сумма, полученная в качестве взятки. Как уточнили журналисты, в апреле 2024 года бронетехнику отправили в Донецк.
«Зырянову было предъявлено обвинение в совершении двух преступлений, предусмотренных статьей 290 УК РФ — получение взятки в особо крупном размере и покушение на взятку», — говорится в сообщении.
В июне 2024 года стало известно о возбуждении уголовного дела в отношении Зырянова и председателя совета директоров УК «Промышленно-логистический парк» Александра Гоманова."
Названы опасные для мужчин после 40 лет упражнения,https://lenta.ru/news/2025/04/13/nazvany-opasnye-dlya-muzhchin-posle-40-let-uprazhneniya/,2025-04-13 22:03:00,"Фитнес-тренер Дэвид Лоуренс назвал упражнения, опасные для мужчин после 40 лет. Его слова приводит Men Today.
Первым опасным упражнением эксперт посчитал жим штанги из-за головы, так как он может негативно сказаться на состоянии плечевых суставов. Следующими станут приседания в тренажере Смита и тяга штанги к подбородку, так как они увеличивают риск травм.
Последним Лоуренс указал жим ногами и тягу верхнего блока за голову. При тренировках он посоветовал соблюдать баланс интенсивности и восстановления.
Ранее эксперт по осанке и естественному омоложению Ольга Махова назвала опасные для полных людей упражнения. Эксперт заявила, что при такой комплекции противопоказано бегать и прыгать на скакалке."
Раскрыто состояние пострадавших при ударе по Сумам,https://lenta.ru/news/2025/04/14/raskryto-sostoyanie-postradavshih-pri-udare-po-sumam/,2025-04-13 21:57:00,"После удара по Сумам в медицинские учреждения были доставлены почти 70 пострадавших. Некоторые находятся в тяжелом состоянии. Эти данные раскрыл президент Украины Владимир Зеленский в Telegram-канале.
«68 пострадавших находятся в медицинских учреждениях. Из них восемь — в тяжелом состоянии», — написал украинский лидер. Он подчеркнул, что врачи оказывают раненым всю необходимую помощь.
Зеленский добавил, что экстренные службы страны работают над ликвидацией последствий ударов.
Ранее сообщалось, что удар пришелся по скоплению военных Вооруженных сил Украины, собравшихся на награждение.
Госслужба Украины по чрезвычайным ситуациям в свою очередь сообщала, что жертвами удара стали 34 человека, еще 117 человек пострадали."
Симоньян предрекла превращение удара по Сумам в «новую Бучу»,https://lenta.ru/news/2025/04/13/simonyan-predrekla-prevraschenie-udara-po-sumam-v-novuyu-buchu/,2025-04-13 21:50:00,"Удар по Сумам будет выдан за «новую Бучу», заявила в своем Telegram-канале главред медиагруппы «Россия сегодня» и RT Маргарита Симоньян.
По ее мнению, «это будет сделано с большой поддержкой прессы и другой драматургией, чтобы впечатлить впечатлительного» президента США Дональда Трампа. Симоньян подчеркнула, что украинские власти «будут пытаться сделать новую Бучу постоянно», потому что «это единственный способ для них сейчас продлить войну».
Ранее президент Украины Владимир Зеленский заявил, что число погибших при ударе в Сумах достигло 34 человек.
Депутат Верховной Рады Марьяна Безуглая рассказала, что удар по центру города Сумы пришелся по скоплению военных. Мэр Конотопа Артем Семенихин сообщил, что они отмечали семилетнюю годовщину создания 117-й бригады теробороны в Сумах, куда пришелся удар."
На Украине заявили о 34 погибших при ударе по Сумам,https://lenta.ru/news/2025/04/13/ukr/,2025-04-13 21:40:00,"В результате удара по Сумам погибли 34 человека. Об этом в Telegram-канале сообщила Госслужба Украины по чрезвычайным ситуациям (ГСЧС).
«По состоянию на 21:00 (время совпадает с московским) в результате происшествия погибли 34 человека, из них двое детей. Травмированы 117 человек, из них 15 детей», — отметили в ведомстве.
Ранее стало известно, что во время удара по Сумам Вооруженные силы Украины (ВСУ) прикрылись гражданскими.
До этого сообщалось, что удар пришелся по скоплению военных, собравшихся на награждение."
В Курской области нашли украинский беспилотник весом 200 килограммов,https://lenta.ru/news/2025/04/14/v-kurskoy-oblasti-nashli-ukrainskiy-bespilotnik-vesom-200-kilogrammov/,2025-04-13 21:35:00,"В Курской области 13 апреля обнаружили упавший украинский беспилотник (БПЛА), способный нести до 50 килограммов нагрузки. Общий вес летательного аппарата составляет 200 килограммов, рассказал временно исполняющий обязанности губернатора региона Александр Хинштейн в Telegram-канале.
Как уточнил глава области, находка была сделана на территории Глушковского района. «Из-за своих габаритов этот БПЛА способен поднимать до 50 килограммов, пролетать со скоростью 150 километров в час до тысячи километров! Не нужно говорить о том, какой урон он способен причинить», — написал Хинштейн.
Он добавил, что место падения беспилотника уже оцепили, вскоре саперы приступят к разминированию.
Днем 13 апреля над Курской и Брянской областями было сбито два беспилотника Вооруженных сил Украины (ВСУ). Также сообщалось, что за прошедшие сутки в Курской области ВСУ потеряли до 190 военнослужащих и военную технику."
На Украине опровергли встречу с представителями России в Турции,https://lenta.ru/news/2025/04/13/ukraina-oprovergla-vstrechu-s-predstavitelyami-rossii-v-turtsii/,2025-04-13 21:34:00,"Информация о запланированной на 15-16 апреля встрече представителей России и Украины по вопросам безопасности в Черном море в Турции не соответствуют действительности. Об этом сообщил телеканал ТСН со ссылкой на главу МИД Украины Андрея Сибигу.
Ведущая телеканала заявила, что министр опроверг планы по переговорам Москвы и Киева о безопасности в Черном море. «Ничего такого, говорит Андрей Сибига, не планировалось», — подчеркнула она.
Ранее сообщалось, что переговоры России и Украины по безопасности судоходства в Черном море должны пройти 15-16 апреля. Об этом заявил телеканал CNN Turk, сославшись на источники в Минобороны Турции. Предполагалось, что переговоры состоятся в Анкаре.
10 апреля в Стамбуле прошли переговоры российской и американской делегаций. Встреча продвинула нормализацию работы посольств двух государств. Пресс-секретарь президента России Дмитрий Песков уточнил, что ситуация вокруг Украины на этих переговорах не обсуждалась."
Российский военный обезвредил дрон ВСУ палкой,https://lenta.ru/news/2025/04/13/dron/,2025-04-13 21:32:00,"Российский военный ударом палки обезвредил дрон Вооруженных сил Украины (ВСУ), который пытался атаковать. Видео инцидента появилось в Telegram-канале военкора Евгения Лисицына.
На кадрах боец с палкой идет среди деревьев. Его атакует беспилотник. Благодаря быстрой реакции военнослужащий обезвреживает аппарат.
25 марта американский видеоблогер и независимый журналист Патрик Ланкастер снял кадры противостояния солдат Вооруженных сил РФ и украинского беспилотника, следовавшего за машиной, в которой ехал репортер. На кадрах видно, как один из бойцов замечает летящий позади автомобиля дрон, после чего по нему открывается огонь из огнестрельного орудия. После сбития беспилотника в машине раздаются радостные возгласы."
В США заявили о планах Трампа превратить Россию в родственную душу Америки,https://lenta.ru/news/2025/04/14/v-ssha-zayavili-o-planah-trampa-prevratit-rossiyu-v-rodstvennuyu-dushu-ameriki/,2025-04-13 21:29:00,"Президент США Дональд Трамп в ходе второго срока хочет изменить отношения с Россией, его политика нацелена на то, чтобы Вашингтон сблизился с Москвой. С такой точкой зрения выступила газета The New York Times (NYT).
Как указывается в материале, на протяжении долгого времени Соединенные Штаты воспринимали Россию как страну, которая может быть фоном, чтобы Вашингтон мог утвердить свои диаметрально противоположные ценности.
«Россия — это воображаемый близнец или темный двойник Америки, сестра-сверхдержава, которую Соединенные Штаты вечно либо демонизируют, либо пытаются переделать по своему образу и подобию», — пишет газета. Однако она отмечает, что так было до вступления Трампа в должность американского лидера.
Сейчас президент США якобы хочет превратить Россию в свою родственную душу, на что указывает его политика и риторика. Для этого он, как пишет NYT, пытается изолировать Китай, в то же время выстраивая более тесные связи с Москвой. В подтверждение этих слов газета напоминает слова американского вице-президента Джей Ди Вэнса, который говорил, что было бы смешно для США «толкать Россию в руки китайцев».
12 апреля стало известно, что Трамп на год продлил действие пакета антироссийских санкций, введенного его предшественником Джо Байденом."
В Раде раскрыли планы Зеленского в отношении России,https://lenta.ru/news/2025/04/13/v-rade-raskryli-plany-zelenskogo-v-otnoshenii-rossii/,2025-04-13 21:25:00,"Депутат Верховной Рады Александр Дубинский, находящийся в СИЗО по подозрению в госизмене, заявил, что президент Украины Владимир Зеленский хочет предложить американскому лидеру Дональду Трампу альтернативный план по Украине. Об этом он написал в Telegram-канале
Дубинский раскрыл планы Зеленского в отношении России и подчеркнул, что тот стремится продолжить конфликт.
«При помощи Франции и Британии Зеленский предлагает Трампу продолжить войну — то есть, создает параллельный мирному проект, которым предлагает воспользоваться США, если у них не сложится с Росссией», — сказал он.
Ранее глава дипломатии Евросоюза Кая Каллас заявила о провале встречи «коалиции желающих» по Украине. Она призналась, что государства, входящие в объединение, обладают разными мнениями по вопросу урегулирования украинского конфликта, из-за чего переговоры пока не дали результатов."
В России призвали власти выступить с заявлением по поводу удара по Сумам,https://lenta.ru/news/2025/04/13/v-rossii-prizvali-vlastey-vystupit-s-zayavleniem-po-povodu-udara-po-sumam/,2025-04-13 21:25:00,"России надо сформулировать свою версию случившегося и выразить соболезнования по поводу гибели мирных жителей после удара по Сумам, заявил в своем Telegram-канале российский политолог Сергей Марков.
«Нельзя сдавать информационное пространство противнику в важные моменты времени и важным проблемам. Позиция России должна звучать громко», — подчеркнул он, отметив, что сейчас после заявлений западных и украинских политиков формируется мнение мирового сообщества.
Марков вместе с этим предложил призвать украинские власти «перестать собирать на военные мероприятия детей и вообще гражданских людей».
Ранее президент Украины Владимир Зеленский заявил, что число погибших при ударе в Сумах достигло 34 человек.
Депутат Верховной Рады Марьяна Безуглая рассказала, что удар по центру города Сумы пришелся по скоплению военных. Мэр Конотопа Артем Семенихин сообщил, что они отмечали семилетнюю годовщину создания 117-й бригады теробороны в Сумах, куда пришелся удар."
Стали известны подробности удара по Сумам,https://lenta.ru/news/2025/04/13/sum/,2025-04-13 21:16:00,"Во время удара по Сумам Вооруженные силы Украины (ВСУ) прикрылись гражданскими. Об этом сообщил Telegram-канал «Архангел спецназа».
Отмечается, что одна из ракет пришлась точно по зданию конгресс-центра Сумского государственного университета, где проходило мероприятие военнослужащих 117-й отдельной бригады территориальной обороны.
«Вторая ракета то ли из-за неточности, то ли из-за воздействия РЭБ попала немного в другое место, из-за чего погибли и пострадали гражданские», — указал источник.
По его данным, российские войска били целенаправленно по скоплению ВСУ, которые в преддверии награждения согнали гражданских в это место.
Ранее народный депутат Верховной Рады Марьяна Безуглая заявила, что ВС России ударили по скоплению военных. Позже стали известны подробности: ликвидированы военные, которые пришли на награждение."
