title,url,date,text
Военный эксперт рассказал о спасенной от военных действий церковной утвари,https://lenta.ru/news/2025/04/13/voennyy-ekspert-rasskazal-o-spasennoy-ot-voennyh-deystviy-tserkovnoy-utvari/,2025-04-13 21:16:00,"Военнослужащие Вооруженных сил Российской Федерации (ВС РФ) спасли церковную утварь от военных действий. Об этом рассказал военно-политический эксперт Ян Гагин, передает РИА Новости.
«Мы находимся в селидовской исправительной колонии. Естественно, мы обследовали территорию, нашли следы пребывания военнослужащих ВСУ и нашли церковь, которая была разграблена военнослужащими Украины (...). Наши бойцы, когда заняли этот объект для того, чтобы сохранить оставшуюся церковную утварь, перенесли иконы, перенесли церковную утварь», — рассказал Гагин.
По его словам, военные готовы помочь представителям Русской православной церкви и вернуть церковную утварь, найденную в Вербное воскресенье.
Ранее Гагин сообщил, что положение Вооруженных сил Украины (ВСУ) в районе Покровска в Донецкой народной республике (ДНР) близко к критическому. К этому привело нарушение логистики ВСУ. Однако какое-то количество боеприпасов гарнизон продолжает получать, пояснил он."
ВСУ ударили по Каменке-Днепровской в Запорожской области,https://lenta.ru/news/2025/04/14/vsu-udarili-po-kamenke-dneprovskoy-v-zaporozhskoy-oblasti/,2025-04-13 21:12:00,"Вооруженные силы Украины (ВСУ) нанесли удар по городу Каменка-Днепровская, расположенному в Запорожской области. Целью атаки стали дома гражданских, рассказал председатель комиссии Общественной палаты РФ по вопросам суверенитета, сопредседатель координационного совета по интеграции новых регионов Владимир Рогов, его цитирует РИА Новости.
«Боевики ВСУ нанесли массированный удар по городу Каменке-Днепровской из РСЗО [реактивной системы залпового огня] Vampire чешского производства», — сообщил Рогов.
Он отметил, что зафиксировано минимум четыре прилета. При этом ВСУ пытались попасть в дома мирных граждан. Пока информация о пострадавших и разрушениях не поступала.
Ранее стало известно, что ВСУ атаковали мост через реку Обеста в Рыльском районе Курской области. Он расположен в двух километрах от границы с Украиной."
Первая переданная России северокорейская Koksan якобы уничтожена в Курской области,https://lenta.ru/news/2025/04/13/pervaya-peredannaya-rossii-severokoreyskaya-koksan-yakoby-unichtozhena-v-kurskoy-oblasti/,2025-04-13 21:02:00,"В Курской области якобы уничтожена первая самоходная артиллерийская установка (САУ) M1989 Koksan переданная России Северной Кореей. Об этом сообщает «Военный осведомитель» со ссылкой на украинские источники.
«Самоходку подловили FPV-дроны в момент транспортировки», — говорится в сообщении. Другие подробности не приводятся, официального подтверждения этой информации также нет.
Ранее сообщалось, что появились новые фото северокорейской артиллерии в зоне проведения специальной военной операции.
В июне в ходе визита президента России Владимира Путина в КНДР лидеры двух стран договорились о всеобъемлющем стратегическом партнерстве. В начале ноября Путин подписал закон о ратификации договора о партнерстве с Северной Кореей. Через несколько дней сообщили, что КНДР также ратифицировала совместный с Россией договор о стратегическом партнерстве."
Жертвой атаки украинского дрона в российском регионе стал водитель грузовика,https://lenta.ru/news/2025/04/13/zhertvoy-ataki-ukrainskogo-drona-v-rossiyskom-regione-stal-voditel-gruzovika/,2025-04-13 20:52:00,"Житель Белгородской области стал жертвой удара украинского дрона по грузовику. Об этом сообщил глава региона Вячеслав Гладков в Telegram-канале.
Беспилотник Вооруженных сил Украины атаковал грузовой автомобиль в поселке Ракитное. Ранения, не совместимые с жизнью, получил водитель. Губернатор принес соболезнования родным и близким мужчины.
В Минобороны России сообщили, что ВСУ за сутки два раза ударили по объектам энергоинфраструктуры России в Белгородской области. В результате обстрела энергообъекта в приграничье без электроснабжения осталось свыше 600 жителей в Шебекинском округе."
Названа сумма призовых футболистам «Зенита» за победу над «Краснодаром»,https://lenta.ru/news/2025/04/13/nazvana-summa-prizovyh-futbolistam-zenita-za-pobedu-nad-krasnodarom/,2025-04-13 20:47:00,"Футболисты петербургского «Зенита» получат призовые за победу над «Краснодаром» в матче 24-го тура Российской премьер-лиги (РПЛ). Об этом сообщает Sport24.
По информации источника, в случае победы каждому игроку обещали по 110 тысяч евро. При этом при разгромном выигрыше с разницей в три мяча и более — по 250 тысяч евро.
Ранее 13 апреля «Зенит» одержал разгромную победу над «Краснодаром». Встреча прошла на стадионе «Санкт-Петербург» и завершилась со счетом 4:1 в пользу хозяев.
Таким образом, после 24 матчей «Краснодар» остается лидером РПЛ, имея в активе 52 очка. «Зенит» располагается на втором месте в турнирной таблице РПЛ, набрав 50 очков."
Власти Украины назвали число погибших в Сумах,https://lenta.ru/news/2025/04/13/vlasti-ukrainy-nazvali-chislo-pogibshih-v-sumah/,2025-04-13 20:42:00,"Президент Украины Владимир Зеленский заявил, что число погибших при ударе в Сумах достигло 34 человек. Об этом он сообщил в своем Telegram-канале.
По его словам, причиной взрывов стали две баллистические ракеты, удар пришелся по центру города.
При этом ранее Государственная служба по чрезвычайным ситуациям Украины сообщила о 32 погибших и более 80 раненых.
В свою очередь, депутат Верховной Рады Марьяна Безуглая заявила, что удар по центру города Сумы пришелся по скоплению военных. Она попросила главнокомандующего Вооруженными силами Украины Александра Сырского и командующего теробороной Игоря Плахуту не собирать военных на награждение в городах.
Мэр Конотопа Артем Семенихин сообщил, что украинские военные отмечали семилетнюю годовщину создания 117-й бригады теробороны в Сумах, куда пришелся удар."
Слова Макрона о России вызвали недоумение во Франции,https://lenta.ru/news/2025/04/13/slova-makrona-o-rossii-vyzvali-nedoumenie-vo-frantsii/,2025-04-13 20:34:00,"Французский политик, лидер партии «Патриоты» Флориан Филиппо удивился словам главы республики Эммануэля Макрона о необходимости принудить Россию к прекращению огня. Публикацию он разместил в соцсети X.
Президент Франции в своем посте призвал к решительным мерам для того, чтобы навязать России прекращение огня. При этом, по словам Макрона, Франция неустанно работает над этим вместе со своими союзниками.
«Что это значит?! ""Навязать"" прекращение огня, отправив еще больше оружия, денег и даже французских солдат на Украину?» — возмутился в ответ Филиппо. Политик также обвинил французского лидера в том, что своими действиями он приближает не перемирие, а третью мировую войну.
Ранее аналитик Центра политических исследований Sciences Po в Париже Брюно Котре заявил, что Макрону теперь доверяет лишь каждый четвертый француз. В частности, по мнению эксперта, избиратели не верят, что французский лидер сможет принять решительные меры в отношении конфликта на Украине."
Минобороны сообщило об уничтожении БПЛА ВСУ над Брянской и Курской областями,https://lenta.ru/news/2025/04/13/minoborony-soobschilo-o-sbitii-bpla-vsu-nad-bryanskoy-i-kurskoy-oblastyami/,2025-04-13 20:25:00,"Два беспилотника самолетного типа Вооруженных сил Украины (ВСУ) были сбиты над Брянской и Курской областями. Об этом сообщило Министерство обороны России в своем Telegram-канале.
«В период с 16:30 до 19:00 мск дежурными средствами ПВО уничтожены два украинских беспилотных летательных аппарата самолетного типа», — указано в сообщении ведомства.
Губернатор Брянской области Александр Богомаз поблагодарил подразделения ПВО за работу и сообщил, что пострадавших и разрушений в результате атаки нет.
Ранее Минобороны сообщило, что в Курской области ВСУ за сутки потеряли до 190 военнослужащих и военную технику. Уничтожены личный состав, танк, БМП и одна бронемашина, 12 автомобилей, реактивная система залпового огня БМ-21 «Град», 4 артиллерийских орудия и три миномета."
На Украине объяснили сбор военных в месте удара ВС России в Сумах,https://lenta.ru/news/2025/04/13/na-ukraine-ob-yasnili-sbor-voennyh-v-meste-udara-vs-rossii-v-sumah/,2025-04-13 20:23:00,"Украинские военные отмечали семилетнюю годовщину создания 117-й бригады теробороны в Сумах, куда пришелся удар ВС России. Об этом сообщил мэр Конотопа Артем Семенихин, передает Strana.ua.
По его словам, военные находились в укрытии и не пострадали. Он также сообщил об уголовном деле из-за сбора бойцов теоробороны. Семенихин обвинил в произошедшем главу Сумской области Владимира Артюха.
Ранее мэр Конотопа призвал губернатора региона уйти в отставку и извиниться за случившееся. В противном случае он обещал раскрыть подробности о сборе военных.
Депутат Верховной Рады Марьяна Безуглая сообщала, что удар пришелся по скоплению военных, собравшихся на награждение. Она напомнила, что за похожие случаи никто из украинских командующих не понес наказания."
Пробравшиеся в тыл ВСУ у Суджи российские бойцы раскрыли детали операции «Поток»,https://lenta.ru/news/2025/04/13/probravshiesya-v-tyl-vsu-u-sudzhi-rossiyskie-boytsy-raskryli-detali-operatsii-potok/,2025-04-13 20:18:00,"Бойцы штурмовой группы, участвовавшие в операции «Поток» по переброске в тыл противника по газовой трубе на территории Курской области, узнали о своей задаче за четыре часа до ее начала. Об этом рассказал командир группы спецназа «Ахмат» с позывным Аид, передает ТАСС.
По его словам, подготовка к операции по проникновению в глубину обороны Вооруженных сил Украины (ВСУ) в районе Суджи проходила в условиях полной секретности с конца февраля. В штурмовую группу отбирались физически крепкие бойцы, не страдающие клаустрофобией. Аид поставил перед ними задачу за четыре часа до выдвижения и захода в газовую трубу.
Они, «как и подобает русскому воину», выслушали спокойно, без вопросов и сомнений пошли за командиром «в темноту трубы», добавил Аид.
Боец штурмовой бригады «Ветераны» Александр Богачев рассказал, что после принятия решения о проведении операции с использованием трубы необходимо было скрытно стравливать газ из нее, чтобы не раскрыть планов перед противником. Давление было в пределах 12 атмосфер, а в действующей трубе порядка 60 атмосфер, добавил он.
В Курске открылась выставка, посвященная операции «Поток», на которой выставлен макет газовой трубы диаметром 144 сантиметра, по которой шли военнослужащие Вооруженных сил России, обмундирование, электромопеды и газовое оборудование, фотографии участников операции с их рассказами о пережитом."
Опубликовано видео с жалобами командира ВСУ на мобилизованных,https://lenta.ru/news/2025/04/13/opublikovano-video-s-zhalobami-komandira-vsu-na-mobilizovannyh/,2025-04-13 20:14:00,"В сети появилось видео с предполагаемым командиром Вооруженных сил Украины (ВСУ), жалующимся на качество присылаемого на фронт пополнения. Ролик в своем Telegram-канале опубликовало украинское издание «Страна».
«Пришло ко мне, к примеру, 50 человек. Один — сразу в СОЧ. Осталось 49. Из них 25 — вроде как ограниченно пригодные, сразу показали соответствующие справки», — сказал представитель ВСУ.
Герой ролика также выразил недоумение относительно отбора мобилизованных в военкоматах и учебных центрах.
Ранее в ВСУ заявили, что за последний месяц ситуация для украинской армии ухудшилась. Спикер 66-й отдельной механизированной бригады имени князя Мстислава Храброго Анастасия Блищик отметила, что у Вооруженных сил России наблюдается преимущество в живой силе и беспилотниках."
Трамп пошутил над Байденом,https://lenta.ru/news/2025/04/13/tramp-poshutil-nad-baydenom/,2025-04-13 19:51:00,"Президент США Дональд Трамп сравнил свой график и стиль общения с прессой со своим предшественником Джо Байденом. Соответствующее видео опубликовано в X.
«В отличие от Байдена, я всегда доступен. Думаете, Байден стал бы давать интервью в два часа ночи?» — пошутил политик, общаясь с журналистами поздно ночью. Следом он пошутил, что экс-лидер Соединенных Штатов не стал бы общаться с прессой и в 9 часов утра.
Ранее сообщалось, что Трамп потребовал отказаться от позиции, продвигаемой Байденом, согласно которой американские ценности изначально были вредными и угнетающими. Об этом стало известно из указа нынешнего главы США.
Перед этим Трамп также заявил, что приходится разбираться с последствиями работы его предшественника. При этом он назвал Байдена худшим президентом Америки."
Панарин обратился с просьбой к ФНС из-за долга,https://lenta.ru/news/2025/04/13/panarin-obratilsya-s-prosboy-k-fns-iz-za-dolga/,2025-04-13 19:49:00,"Российский нападающий клуба Национальной хоккейной лиги (НХЛ) «Нью-Йорк Рейнджерс» Артемий Панарин в интервью YouTube-каналу «Это хоккей, брат!» обратился с просьбой к Федеральной налоговой службе (ФНС) России из-за долга.
«Не наказывайте меня. Налоги капают, пени капают. Деньги есть, все заплачу. Просто не могу сейчас», — заявил хоккеист. Он объяснил, что ему нужно изменить информацию в «Госуслугах», чтобы оплатить долг, однако он сможет сделать это только по возвращении в Россию.
3 февраля Telegram-канал Mash сообщил, что Панарин задолжал российской налоговой. Сумма составила 75 тысяч рублей.
Среднегодовая сумма контракта Панарина с «Рейнджерс» составляет 11,6 миллиона долларов. Он является одним из самых высокооплачиваемых игроков НХЛ."
Стало известно о грозящем экс-замминистра обороны Иванову новом уголовном деле,https://lenta.ru/news/2025/04/13/stalo-izvestno-o-grozyaschem-novom-ugolovnom-dele-protiv-eks-zamministra-oborony-ivanova/,2025-04-13 19:47:00,"Бывшему заместителю министра обороны Тимуру Иванову грозит новое дело. Об этом сообщает Telegram-канал Mash.
«Арестованному замминистра обороны Тимуру Иванову грозит новое дело. Его знаменитый особняк из ""Мастера и Маргариты"" могли ремонтировать за счет военного подрядчика», — указано в сообщении.
Как пишет Mash, компания ООО «Дворянское гнездо» арендовала дом на 49 лет и попыталась через суд вернуть деньги, потраченные на последний ремонт, у соинвестора ООО «Оборонспецстрой», связанного с госзаказами министерства обороны. «Дворянское гнездо», как отмечается, хочет компенсировать расходы через военного подрядчика — на то якобы были соответствующие договоренности. Суд отказал в иске в двух инстанциях ввиду отсутствия доказательств. Компании между тем не стали комментировать связь с Тимуром Ивановым.
Ранее стало известно, что общая сумма ущерба по делу в отношении экс-замминистра обороны о растрате и вывода из банка денежных средств превысила 4,1 миллиарда рублей."
